{
  "metadata": {
    "systemName": "LEGACY+",
    "version": "clients.v2.workbook-aligned",
    "region": "Malaysia",
    "timezone": "Asia/Kuala_Lumpur",
    "effectiveDate": "2026-03-23",
    "sourceWorkbook": "LEGACY+_XP_System_v2_FIXED.xlsx"
  },
  "settings": {
    "routineWeeklyCapXP": 300,
    "monthlyCoinCap": 70,
    "coinValueRM": 0.5,
    "weekStart": "MON",
    "countOnlyVerified": true
  },
  "xpCurve": {
    "type": "quadratic_n_squared",
    "maxLevel": 100,
    "xpAtMaxLevel": 10000,
    "formula": "cumulative_xp(level)=level^2",
    "levelFromXP": "level=min(100, floor(sqrt(total_xp)))"
  },
  "actions": [
    {
      "actionId": "ACH-100SESS",
      "displayName": "100 Sessions Attended (Annual)",
      "category": "Achievement",
      "earnType": "Achievement",
      "xp": 300,
      "coins": 30,
      "cap": null,
      "cooldownDays": 0,
      "verificationRequired": true
    },
    {
      "actionId": "ACH-150SESS",
      "displayName": "150 Sessions Attended (Annual)",
      "category": "Achievement",
      "earnType": "Achievement",
      "xp": 450,
      "coins": 45,
      "cap": null,
      "cooldownDays": 0,
      "verificationRequired": true
    },
    {
      "actionId": "ACH-200SESS",
      "displayName": "200 Sessions Attended (Annual)",
      "category": "Achievement",
      "earnType": "Achievement",
      "xp": 600,
      "coins": 60,
      "cap": null,
      "cooldownDays": 0,
      "verificationRequired": true
    },
    {
      "actionId": "ACH-FBP-10",
      "displayName": "Female Bench 1.0× BW Achieved",
      "category": "Achievement",
      "earnType": "Achievement",
      "xp": 120,
      "coins": 12,
      "cap": null,
      "cooldownDays": 0,
      "verificationRequired": true
    },
    {
      "actionId": "ACH-FBP-75",
      "displayName": "Female Bench 0.75× BW Achieved",
      "category": "Achievement",
      "earnType": "Achievement",
      "xp": 70,
      "coins": 7,
      "cap": null,
      "cooldownDays": 0,
      "verificationRequired": true
    },
    {
      "actionId": "ACH-FDL-175",
      "displayName": "Female Deadlift 1.75× BW Achieved",
      "category": "Achievement",
      "earnType": "Achievement",
      "xp": 100,
      "coins": 10,
      "cap": null,
      "cooldownDays": 0,
      "verificationRequired": true
    },
    {
      "actionId": "ACH-FDL-225",
      "displayName": "Female Deadlift 2.25× BW Achieved",
      "category": "Achievement",
      "earnType": "Achievement",
      "xp": 170,
      "coins": 17,
      "cap": null,
      "cooldownDays": 0,
      "verificationRequired": true
    },
    {
      "actionId": "ACH-FSQ-125",
      "displayName": "Female Squat 1.25× BW Achieved",
      "category": "Achievement",
      "earnType": "Achievement",
      "xp": 80,
      "coins": 8,
      "cap": null,
      "cooldownDays": 0,
      "verificationRequired": true
    },
    {
      "actionId": "ACH-FSQ-175",
      "displayName": "Female Squat 1.75× BW Achieved",
      "category": "Achievement",
      "earnType": "Achievement",
      "xp": 140,
      "coins": 14,
      "cap": null,
      "cooldownDays": 0,
      "verificationRequired": true
    },
    {
      "actionId": "ACH-MBP-125",
      "displayName": "Male Bench 1.25× BW Achieved",
      "category": "Achievement",
      "earnType": "Achievement",
      "xp": 70,
      "coins": 7,
      "cap": null,
      "cooldownDays": 0,
      "verificationRequired": true
    },
    {
      "actionId": "ACH-MBP-15",
      "displayName": "Male Bench 1.5× BW Achieved",
      "category": "Achievement",
      "earnType": "Achievement",
      "xp": 120,
      "coins": 12,
      "cap": null,
      "cooldownDays": 0,
      "verificationRequired": true
    },
    {
      "actionId": "ACH-MDL-20",
      "displayName": "Male Deadlift 2.0× BW Achieved",
      "category": "Achievement",
      "earnType": "Achievement",
      "xp": 100,
      "coins": 10,
      "cap": null,
      "cooldownDays": 0,
      "verificationRequired": true
    },
    {
      "actionId": "ACH-MDL-25",
      "displayName": "Male Deadlift 2.5× BW Achieved",
      "category": "Achievement",
      "earnType": "Achievement",
      "xp": 170,
      "coins": 17,
      "cap": null,
      "cooldownDays": 0,
      "verificationRequired": true
    },
    {
      "actionId": "ACH-MSQ-15",
      "displayName": "Male Squat 1.5× BW Achieved",
      "category": "Achievement",
      "earnType": "Achievement",
      "xp": 80,
      "coins": 8,
      "cap": null,
      "cooldownDays": 0,
      "verificationRequired": true
    },
    {
      "actionId": "ACH-MSQ-20",
      "displayName": "Male Squat 2.0× BW Achieved",
      "category": "Achievement",
      "earnType": "Achievement",
      "xp": 140,
      "coins": 14,
      "cap": null,
      "cooldownDays": 0,
      "verificationRequired": true
    },
    {
      "actionId": "SOC-30SELF",
      "displayName": "“30 Gym-Mirror Selfies” Achievement",
      "category": "Achievement",
      "earnType": "Achievement",
      "xp": 40,
      "coins": 4,
      "cap": null,
      "cooldownDays": 0,
      "verificationRequired": true
    },
    {
      "actionId": "BOSS-CLR-10",
      "displayName": "Boss Gate Cleared – Level 10",
      "category": "Boss",
      "earnType": "Boss",
      "xp": 50,
      "coins": 5,
      "cap": null,
      "cooldownDays": 0,
      "verificationRequired": true
    },
    {
      "actionId": "BOSS-CLR-100",
      "displayName": "Boss Gate Cleared – Level 100",
      "category": "Boss",
      "earnType": "Boss",
      "xp": 500,
      "coins": 50,
      "cap": null,
      "cooldownDays": 0,
      "verificationRequired": true
    },
    {
      "actionId": "BOSS-CLR-25",
      "displayName": "Boss Gate Cleared – Level 25",
      "category": "Boss",
      "earnType": "Boss",
      "xp": 100,
      "coins": 10,
      "cap": null,
      "cooldownDays": 0,
      "verificationRequired": true
    },
    {
      "actionId": "BOSS-CLR-40",
      "displayName": "Boss Gate Cleared – Level 40",
      "category": "Boss",
      "earnType": "Boss",
      "xp": 150,
      "coins": 15,
      "cap": null,
      "cooldownDays": 0,
      "verificationRequired": true
    },
    {
      "actionId": "BOSS-CLR-60",
      "displayName": "Boss Gate Cleared – Level 60",
      "category": "Boss",
      "earnType": "Boss",
      "xp": 250,
      "coins": 25,
      "cap": null,
      "cooldownDays": 0,
      "verificationRequired": true
    },
    {
      "actionId": "BOSS-CLR-80",
      "displayName": "Boss Gate Cleared – Level 80",
      "category": "Boss",
      "earnType": "Boss",
      "xp": 350,
      "coins": 35,
      "cap": null,
      "cooldownDays": 0,
      "verificationRequired": true
    },
    {
      "actionId": "SOC-CI",
      "displayName": "Gym Check-In",
      "category": "Community",
      "earnType": "Routine",
      "xp": 5,
      "coins": 0,
      "cap": null,
      "cooldownDays": 0,
      "verificationRequired": true
    },
    {
      "actionId": "SOC-REC",
      "displayName": "Weekly Social Post",
      "category": "Community",
      "earnType": "Routine",
      "xp": 10,
      "coins": 1,
      "cap": null,
      "cooldownDays": 0,
      "verificationRequired": true
    },
    {
      "actionId": "SOC-REFC",
      "displayName": "Friend Attended Consult",
      "category": "Community",
      "earnType": "Milestone",
      "xp": 20,
      "coins": 2,
      "cap": null,
      "cooldownDays": 0,
      "verificationRequired": true
    },
    {
      "actionId": "SOC-REFJ",
      "displayName": "Referral Joined",
      "category": "Community",
      "earnType": "Milestone",
      "xp": 80,
      "coins": 8,
      "cap": null,
      "cooldownDays": 0,
      "verificationRequired": true
    },
    {
      "actionId": "SOC-SUPP",
      "displayName": "Community Support Shown (Coach Nominated)",
      "category": "Community",
      "earnType": "Milestone",
      "xp": 30,
      "coins": 3,
      "cap": null,
      "cooldownDays": 0,
      "verificationRequired": true
    },
    {
      "actionId": "BNG-AUTODEB-3M",
      "displayName": "On-time Auto-Debit Success – 3 Months",
      "category": "Compliance",
      "earnType": "Routine",
      "xp": 15,
      "coins": 2,
      "cap": null,
      "cooldownDays": 0,
      "verificationRequired": true
    },
    {
      "actionId": "CMP-ATT-100W",
      "displayName": "100% Attendance for Booked Sessions (Weekly)",
      "category": "Compliance",
      "earnType": "Routine",
      "xp": 10,
      "coins": 1,
      "cap": null,
      "cooldownDays": 0,
      "verificationRequired": true
    },
    {
      "actionId": "CMP-FBK-M",
      "displayName": "Submit Monthly Feedback (NPS + Comments)",
      "category": "Compliance",
      "earnType": "Routine",
      "xp": 10,
      "coins": 1,
      "cap": null,
      "cooldownDays": 0,
      "verificationRequired": true
    },
    {
      "actionId": "CMP-NOSHOW-0M",
      "displayName": "0 Late Cancels/No-Shows (Monthly)",
      "category": "Compliance",
      "earnType": "Routine",
      "xp": 20,
      "coins": 2,
      "cap": null,
      "cooldownDays": 0,
      "verificationRequired": true
    },
    {
      "actionId": "TRN-WKCI",
      "displayName": "Weekly Check-In Submitted",
      "category": "Compliance",
      "earnType": "Routine",
      "xp": 10,
      "coins": 1,
      "cap": null,
      "cooldownDays": 0,
      "verificationRequired": true
    },
    {
      "actionId": "ENG-HIIT",
      "displayName": "HIIT / Intervals",
      "category": "Conditioning",
      "earnType": "Routine",
      "xp": 20,
      "coins": 2,
      "cap": null,
      "cooldownDays": 0,
      "verificationRequired": true
    },
    {
      "actionId": "ENG-OUT",
      "displayName": "Outdoor Cardio (No GPS)",
      "category": "Conditioning",
      "earnType": "Routine",
      "xp": 20,
      "coins": 2,
      "cap": null,
      "cooldownDays": 0,
      "verificationRequired": true
    },
    {